"Section"	"section_id"	"req_id"	"Test Availability"	"class_def"	"method"	"module"	"method_text"	"full_key"	"requirement"	"key_as_number"	"search_terms"	"manual_search_terms"	"not_search_terms"	"not_files"	"matched_terms"	"search_roots"	"qualified_method"	"max_matches"	"file_name"	"matched_files"	"methods_string"	"urls"	"protected"	"Area"	"Shortened"	"Test Level"
"45:237196) 3  . Software"	"3"	"A-1-1"	""	""	""	""	""	"3/A-1-1"	""">3/A-1-1] MUST NOT attach special privileges to system application&#39;s use of these properties, or prevent third-party applications from using these properties. [<a href=""#3_0_intro"""""	"03000000.650101"	""	""	""	""	""	""	""	""	""	""	""	""	""	""	""	""
"45:237196) 3  . Software"	"3"	"A-1-2"	""	""	""	""	""	"3/A-1-2"	""">3/A-1-2] MUST NOT replicate a vehicle property that already exists in the SDK. Automotive device implementations: [<a href=""#3_2_soft_api_compatibility"""""	"03000000.650102"	""	""	""	""	""	""	""	""	""	""	""	""	""	""	""	""
"47:241668) 3.1.1  . Android Extensions"	"3.1.1"	"C-0-3"	""	""	""	""	""	"3.1.1/C-0-3"	"""C-0-3] MUST support all the APIs defined by the extension versions returned by android.os.ext.SdkExtensions.getExtensionVersion(int apiLevel) in the same manner as other managed APIs are supported, following the requirements in section 3.1. <h4 id=""312_android_library"" """	"03010100.670003"	"android.os.ext.SdkExtensions.getExtensionVersion"	""	""	""	""	""	""	""	""	""	""	""	""	""	""	""
"47:241668) 3.1.1  . Android Extensions"	"3.1.1"	"C-0-2"	""	""	""	""	""	"3.1.1/C-0-2"	"""C-0-2] MUST only return valid extension version number that have been defined by the AOSP. """	"03010100.670002"	""	""	""	""	""	""	""	""	""	""	""	""	""	""	""	""
"53:256677) 3.2.3.1  . Common Application Intents"	"3.2.3.1"	"A-0-1"	""	""	""	""	""	"3.2.3.1/A-0-1"	""">3.2.3.1/A-0-1] MUST preload one or more applications or service components with an intent handler, for all the public intent filter patterns defined by the following application intents listed here. [<a href=""#3_4_web_compatibility"""""	"03020301.650001"	""	""	""	""	""	""	""	""	""	""	""	""	""	""	""	""
"53:256677) 3.2.3.1  . Common Application Intents"	"3.2.3.1"	"Tab-0-1"	""	""	""	""	""	"3.2.3.1/Tab-0-1"	""">3.2.3.1/Tab-0-1] MUST preload one or more applications or service components with an intent handler, for all the public intent filter patterns defined by the following application intents listed here. <h2 id=""3_software"" """	"03020301.980001"	""	""	""	""	""	""	""	""	""	""	""	""	""	""	""	""
"57:278237) 3.2.3.5  . Conditional Application Intents"	"3.2.3.5"	"C-6-1"	""	"[('android.app.cts.NotificationManagerTest', 10), ('android.app.notification.legacy.cts.ConditionProviderServiceTest', 10), ('android.media.cts.AudioManagerTest', 9), ('android.telecom.cts.CarModeInCallServiceTest', 6), ('com.android.cts.verifier.audio.RingerModeActivity', 3), ('android.app.cts.NotificationChannelTest', 2), ('android.accessibilityservice.cts.AccessibilityEndToEndTest', 2), ('android.systemintents.cts.TestSystemIntents', 2), ('android.hardware.camera2.cts.CameraManagerTest', 2), ('android.server.wm.CrossAppDragAndDropTests', 2), ('android.app.notification.legacy.cts.LegacyNotificationManagerTest', 2), ('android.net.wifi.cts.WifiNetworkSuggestionTest', 1), ('android.media.cts.MediaActivityTest', 1), ('android.app.notification.legacy20.cts.LegacyNotificationManager20Test', 1), ('com.android.cts.delegate.CertInstallDelegateTest', 1), ('com.android.cts.profileowner.AdminActionBookkeepingTest', 1), ('com.android.cts.deviceandprofileowner.SecurityLoggingTest', 1), ('com.android.cts.deviceandprofileowner.DelegatedCertInstallerTest', 1), ('com.android.cts.deviceowner.AdminActionBookkeepingTest', 1), ('android.ndef.cts.NdefTest', 1), ('android.provider.cts.simphonebook.SimPhonebookContract_SimRecordsNoSimTest', 1), ('android.app.cts.UiModeManagerTest', 1), ('android.app.notification.legacy29.cts.NotificationManager29Test', 1), ('com.android.cts.certinstaller.DirectDelegatedCertInstallerTest', 1)]"	"[('setUp', 19), ('getInstrumentation', 16), ('tearDown', 13), ('getContext', 9), ('of', 8), ('getPackageManager', 7), ('getPackageName', 7), ('getId', 7), ('build', 6), ('toString', 5), ('getActiveNotifications', 5), ('getWho', 4), ('getBytes', 4), ('getContentResolver', 4), ('getMessage', 4), ('create', 2), ('getResources', 2), ('getSystem', 2), ('getRingerMode', 2), ('getUiAutomation', 2), ('reset', 2), ('cancelAll', 2), ('printStackTrace', 2), ('getKey', 2), ('getGroupKey', 2), ('supportsSplitScreenMultiWindow', 2), ('supportsFreeform', 2), ('setUpClass', 1), ('getService', 1), ('areChannelsBypassingDnd', 1), ('hasVibrator', 1), ('getNotificationPolicy', 1), ('getCurrentInterruptionFilter', 1), ('getCurrentModeType', 1), ('BroadcastReceiver', 1), ('getAction', 1), ('release', 1), ('IntentFilter', 1), ('getSimpleName', 1), ('randomUUID', 1), ('getNotificationChannels', 1), ('getNotificationChannelGroups', 1), ('getCount', 1), ('moveToFirst', 1), ('close', 1), ('getPendingIntent', 1), ('getClass', 1), ('getGroup', 1), ('getNotification', 1), ('getOverrideGroupKey', 1), ('getUserId', 1)]"	""	""	"3.2.3.5/C-6-1"	"""C-6-1] MUST implement an activity that would respond to the intent ACTION_NOTIFICATION_POLICY_ACCESS_SETTINGS, which for implementations with UI_MODE_TYPE_NORMAL it MUST be an activity where the user can grant or deny the app access to DND policy configurations. If device implementations allow users to use third-party input methods on the device, they: """	"03020305.670601"	"ACTION_NOTIFICATION_POLICY_ACCESS_SETTINGS DND MODE_TYPE_NORMAL"	""	""	""	"[('DND', 54), ('MODE_TYPE_NORMAL', 7), ('ACTION_NOTIFICATION_POLICY_ACCESS_SETTINGS', 2)]"	""	"[('[android.accessibilityservice.cts.AccessibilityEndToEndTest testTypeNotificationStateChangedAccessibilityEvent None]', 2), ('[android.hardware.camera2.cts.CameraManagerTest testCameraManagerWithDnD None]', 2), ('[android.server.wm.CrossAppDragAndDropTests uptimeMillis None]', 2), ('[android.app.notification.legacy.cts.ConditionProviderServiceTest testUnboundCPSMaintainsCondition_addsNewRule None]', 2), ('[android.app.notification.legacy.cts.ConditionProviderServiceTest testUnboundCPSMaintainsCondition_otherConditionChanges None]', 2), ('[android.app.notification.legacy.cts.ConditionProviderServiceTest testUnboundCPSMaintainsCondition_otherProviderRuleChanges None]', 2), ('[android.app.notification.legacy.cts.ConditionProviderServiceTest testRequestRebindWhenLostAccess None]', 2), ('[android.app.notification.legacy.cts.ConditionProviderServiceTest testMethodsExistAndDoNotThrow None]', 2), ('[android.app.cts.NotificationChannelTest testConstructor None]', 1), ('[android.app.cts.NotificationChannelTest testWriteToParcel None]', 1), ('[android.net.wifi.cts.WifiNetworkSuggestionTest isLocationEnabled None]', 1), ('[android.media.cts.MediaActivityTest ArrayList None]', 1), ('[android.app.notification.legacy20.cts.LegacyNotificationManager20Test testNotificationListener_cancelNotifications None]', 1), ('[android.media.cts.AudioManagerTest isMicrophoneMute None]', 1), ('[android.media.cts.AudioManagerTest testMuteDndAffectedStreams None]', 1), ('[android.media.cts.AudioManagerTest testMuteDndUnaffectedStreams None]', 1), ('[android.media.cts.AudioManagerTest testSetStreamVolumeInPriorityOnlyMode None]', 1), ('[android.media.cts.AudioManagerTest testAdjustVolumeInPriorityOnly None]', 1), ('[android.media.cts.AudioManagerTest testPriorityOnlyMuteAll None]', 1), ('[android.media.cts.AudioManagerTest testPriorityOnlyMediaAllowed None]', 1), ('[android.media.cts.AudioManagerTest testPriorityOnlyAlarmsAllowed None]', 1), ('[android.media.cts.AudioManagerTest testPriorityOnlyChannelsCanBypassDnd None]', 1), ('[android.telecom.cts.CarModeInCallServiceTest dropShellPermissionIdentity None]', 1), ('[android.telecom.cts.CarModeInCallServiceTest testSetCarMode None]', 1), ('[android.telecom.cts.CarModeInCallServiceTest testStartCallInCarMode None]', 1), ('[android.telecom.cts.CarModeInCallServiceTest testSwitchToCarMode None]', 1), ('[android.telecom.cts.CarModeInCallServiceTest testSwitchToCarModeAndBack None]', 1), ('[android.telecom.cts.CarModeInCallServiceTest testSwitchToCarModeMultiple None]', 1), ('[android.app.cts.NotificationManagerTest isGroup None]', 1), ('[android.app.cts.NotificationManagerTest testConsolidatedNotificationPolicy None]', 1), ('[android.app.cts.NotificationManagerTest testConsolidatedNotificationPolicyMultiRules None]', 1), ('[android.app.cts.NotificationManagerTest testCreateChannel None]', 1), ('[android.app.cts.NotificationManagerTest testTotalSilenceOnlyMuteStreams None]', 1), ('[android.app.cts.NotificationManagerTest testAlarmsOnlyMuteStreams None]', 1), ('[android.app.cts.NotificationManagerTest testSetAutomaticZenRuleState None]', 1), ('[android.app.cts.NotificationManagerTest testSetAutomaticZenRuleState_turnOff None]', 1), ('[android.app.cts.NotificationManagerTest testSetAutomaticZenRuleState_deletedRule None]', 1), ('[android.app.cts.NotificationManagerTest testSetAutomaticZenRuleState_multipleRules None]', 1), ('[android.ndef.cts.NdefTest testInvalidParsing None]', 1), ('[android.provider.cts.simphonebook.SimPhonebookContract_SimRecordsNoSimTest insert_nonAdnDirUris_throwsUnsupportedOperationException None]', 1), ('[android.app.notification.legacy.cts.LegacyNotificationManagerTest testChannelDeletion_cancelReason None]', 1), ('[android.app.cts.UiModeManagerTest testEnterCarModePrioritized None]', 1), ('[android.app.notification.legacy.cts.LegacyNotificationManagerTest testSetNotificationPolicy_preP_setOldNewFields None]', 1), ('[android.app.notification.legacy29.cts.NotificationManager29Test isNotificationPolicyAccessGranted None]', 1), ('[com.android.cts.verifier.audio.RingerModeActivity isLowRamDevice None]', 1), ('[com.android.cts.verifier.audio.RingerModeActivity TestVolumeDndAffectedStreamDndOn None]', 1), ('[com.android.cts.verifier.audio.RingerModeActivity TestVolumeDndAffectedStream None]', 1)]"	""	"[('/home/gpoor/cts-source/cts/tests/app/src/android/app/cts/NotificationManagerTest.java', 10), ('/home/gpoor/cts-source/cts/tests/tests/media/src/android/media/cts/AudioManagerTest.java', 9), ('/home/gpoor/cts-source/cts/tests/tests/telecom/src/android/telecom/cts/CarModeInCallServiceTest.java', 6), ('/home/gpoor/cts-12-source/cts/tests/tests/notificationlegacy/notificationlegacy27/src/android/app/notification/legacy/cts/ConditionProviderServiceTest.java', 5), ('/home/gpoor/cts-source/cts/tests/tests/notificationlegacy/notificationlegacy27/src/android/app/notification/legacy/cts/ConditionProviderServiceTest.java', 5), ('/home/gpoor/cts-12-source/cts/apps/CtsVerifier/src/com/android/cts/verifier/audio/RingerModeActivity.java', 3), ('/home/gpoor/cts-source/cts/tests/app/src/android/app/cts/NotificationChannelTest.java', 2), ('/home/gpoor/cts-12-source/cts/tests/tests/wifi/src/android/net/wifi/cts/WifiNetworkSuggestionTest.java', 1), ('/home/gpoor/cts-source/cts/tests/accessibilityservice/src/android/accessibilityservice/cts/AccessibilityEndToEndTest.java', 1), ('/home/gpoor/cts-12-source/cts/tests/tests/media/src/android/media/cts/MediaActivityTest.java', 1), ('/home/gpoor/cts-source/cts/tests/tests/notificationlegacy/notificationlegacy20/src/android/app/notification/legacy20/cts/LegacyNotificationManager20Test.java', 1), ('/home/gpoor/cts-source/cts/tests/tests/systemintents/src/android/systemintents/cts/TestSystemIntents.java', 1), ('/home/gpoor/cts-source/cts/hostsidetests/devicepolicy/app/DelegateApp/src/com/android/cts/delegate/CertInstallDelegateTest.java', 1), ('/home/gpoor/cts-source/cts/hostsidetests/devicepolicy/app/ProfileOwner/src/com/android/cts/profileowner/AdminActionBookkeepingTest.java', 1), ('/home/gpoor/cts-source/cts/hostsidetests/devicepolicy/app/DeviceAndProfileOwner/src/com/android/cts/deviceandprofileowner/SecurityLoggingTest.java', 1), ('/home/gpoor/cts-source/cts/hostsidetests/devicepolicy/app/DeviceAndProfileOwner/src/com/android/cts/deviceandprofileowner/DelegatedCertInstallerTest.java', 1), ('/home/gpoor/cts-source/cts/hostsidetests/devicepolicy/app/DeviceOwner/src/com/android/cts/deviceowner/AdminActionBookkeepingTest.java', 1), ('/home/gpoor/cts-12-source/cts/tests/accessibilityservice/src/android/accessibilityservice/cts/AccessibilityEndToEndTest.java', 1), ('/home/gpoor/cts-12-source/cts/tests/camera/src/android/hardware/camera2/cts/CameraManagerTest.java', 1), ('/home/gpoor/cts-12-source/cts/tests/framework/base/windowmanager/src/android/server/wm/CrossAppDragAndDropTests.java', 1), ('/home/gpoor/cts-source/cts/tests/framework/base/windowmanager/src/android/server/wm/CrossAppDragAndDropTests.java', 1), ('/home/gpoor/cts-source/cts/tests/tests/ndef/src/android/ndef/cts/NdefTest.java', 1), ('/home/gpoor/cts-12-source/cts/tests/tests/simphonebookprovider/src/android/provider/cts/simphonebook/SimPhonebookContract_SimRecordsNoSimTest.java', 1), ('/home/gpoor/cts-12-source/cts/tests/tests/notificationlegacy/notificationlegacy27/src/android/app/notification/legacy/cts/LegacyNotificationManagerTest.java', 1), ('/home/gpoor/cts-source/cts/tests/app/src/android/app/cts/UiModeManagerTest.java', 1), ('/home/gpoor/cts-12-source/cts/tests/tests/systemintents/src/android/systemintents/cts/TestSystemIntents.java', 1), ('/home/gpoor/cts-source/cts/tests/tests/notificationlegacy/notificationlegacy27/src/android/app/notification/legacy/cts/LegacyNotificationManagerTest.java', 1), ('/home/gpoor/cts-source/cts/tests/tests/notificationlegacy/notificationlegacy29/src/android/app/notification/legacy29/cts/NotificationManager29Test.java', 1), ('/home/gpoor/cts-source/cts/tests/camera/src/android/hardware/camera2/cts/CameraManagerTest.java', 1), ('/home/gpoor/cts-source/cts/hostsidetests/devicepolicy/app/CertInstaller/src/com/android/cts/certinstaller/DirectDelegatedCertInstallerTest.java', 1)]"	"[('(1,DND,/android/accessibilityservice/cts/AccessibilityEndToEndTest.java)', 2), ('(1,ACTION_NOTIFICATION_POLICY_ACCESS_SETTINGS,/android/systemintents/cts/TestSystemIntents.java)', 2), ('(6,DND,/android/hardware/camera2/cts/CameraManagerTest.java)', 2), ('(3,DND,/android/server/wm/CrossAppDragAndDropTests.java)', 2), ('(2,DND,/android/app/notification/legacy/cts/LegacyNotificationManagerTest.java)', 2), ('(10,DND,/android/app/notification/legacy/cts/ConditionProviderServiceTest.java)', 2), ('(2,DND,/android/app/cts/NotificationChannelTest.java)', 1), ('(1,DND,/android/net/wifi/cts/WifiNetworkSuggestionTest.java)', 1), ('(1,DND,/android/media/cts/MediaActivityTest.java)', 1), ('(2,DND,/android/app/notification/legacy20/cts/LegacyNotificationManager20Test.java)', 1), ('(31,DND,/android/media/cts/AudioManagerTest.java)', 1), ('(1,DND,/com/android/cts/delegate/CertInstallDelegateTest.java)', 1), ('(1,DND,/com/android/cts/profileowner/AdminActionBookkeepingTest.java)', 1), ('(7,MODE_TYPE_NORMAL,/android/telecom/cts/CarModeInCallServiceTest.java)', 1), ('(1,DND,/com/android/cts/deviceandprofileowner/SecurityLoggingTest.java)', 1), ('(1,DND,/com/android/cts/deviceandprofileowner/DelegatedCertInstallerTest.java)', 1), ('(40,DND,/android/app/cts/NotificationManagerTest.java)', 1), ('(1,DND,/com/android/cts/deviceowner/AdminActionBookkeepingTest.java)', 1), ('(2,DND,/android/ndef/cts/NdefTest.java)', 1), ('(1,DND,/android/provider/cts/simphonebook/SimPhonebookContract_SimRecordsNoSimTest.java)', 1), ('(1,MODE_TYPE_NORMAL,/android/app/cts/UiModeManagerTest.java)', 1), ('(2,DND,/android/app/notification/legacy29/cts/NotificationManager29Test.java)', 1), ('(22,DND,/com/android/cts/verifier/audio/RingerModeActivity.java)', 1), ('(1,DND,/com/android/cts/certinstaller/DirectDelegatedCertInstallerTest.java)', 1)]"	"[('([2:/android/app/notification/legacy/cts/ConditionProviderServiceTest.java]:[DND]:[2]:method_text:[ote        assertEquals(INTERRUPTION_FILTER_ALARMS, mNm.getCurrentInterruptionFilter());    }   ])', 4), ('([1:/android/app/cts/NotificationManagerTest.java]:[DND]:[1]:method_text:[nalFilter);            mNotificationManager.setNotificationPolicy(origPolicy);        }    }   ])', 3), ('([1:/android/accessibilityservice/cts/AccessibilityEndToEndTest.java]:[DND]:[1]:method_text:[notificationManager.deleteNotificationChannel(channel.getId());        }    }    @MediumTest   ])', 2), ('([1:/android/systemintents/cts/TestSystemIntents.java]:[ACTION_NOTIFICATION_POLICY_ACCESS_SETTINGS]:[1]:method_text:[etInstrumentation().getContext();        mPackageManager = mContext.getPackageManager();    }   ])', 2), ('([2:/android/media/cts/AudioManagerTest.java]:[DND]:[2]:method_text:[            setInterruptionFilter(NotificationManager.INTERRUPTION_FILTER_ALL);        }    }   ])', 2), ('([3:/android/media/cts/AudioManagerTest.java]:[DND]:[3]:method_text:[            setInterruptionFilter(NotificationManager.INTERRUPTION_FILTER_ALL);        }    }   ])', 2), ('([6:/android/hardware/camera2/cts/CameraManagerTest.java]:[DND]:[6]:method_text:[        throw new IOException(""Could not read stdout of command:\xa0"" + command, e);        }    }}])', 2), ('([3:/android/server/wm/CrossAppDragAndDropTests.java]:[DND]:[3]:method_text:[result mismatch,"", expectedResult,                    results.get(resultKey));        }    }   ])', 2), ('([2:/android/app/notification/legacy/cts/LegacyNotificationManagerTest.java]:[DND]:[2]:method_text:[ {      return mContext.getPackageManager().hasSystemFeature(PackageManager.FEATURE_WATCH);    }}])', 2), ('([3:/android/app/notification/legacy/cts/ConditionProviderServiceTest.java]:[DND]:[3]:method_text:[ote        assertEquals(INTERRUPTION_FILTER_ALARMS, mNm.getCurrentInterruptionFilter());    }   ])', 2), ('([1:/android/app/notification/legacy/cts/ConditionProviderServiceTest.java]:[DND]:[1]:method_text:[nd after permission lost"");        } catch (Exception e) {            // pass        }    }   ])', 2), ('([2:/android/app/notification/legacy/cts/ConditionProviderServiceTest.java]:[DND]:[2]:method_text:[ } else {            Log.d(TAG, service.getName() + "" has a correct bind state"");        }    }}])', 2), ('([1:/android/app/cts/NotificationChannelTest.java]:[DND]:[1]:method_text:[ll(channel.getParentChannelId());        assertFalse(channel.isImportantConversation());    }   ])', 1), ('([1:/android/app/cts/NotificationChannelTest.java]:[DND]:[1]:method_text:[icationChannel.CREATOR.createFromParcel(parcel);        assertEquals(channel, channel1);    }   ])', 1), ('([1:/android/net/wifi/cts/WifiNetworkSuggestionTest.java]:[DND]:[1]:method_text:[   }    /**     * Tests {@link android.net.wifi.WifiNetworkSuggestion.Builder} class.     */   ])', 1), (""([1:/android/media/cts/MediaActivityTest.java]:[DND]:[1]:method_text:[    }    /**     * Tests whether volume key changes volume with the session's stream.     */   ])"", 1), ('([2:/android/app/notification/legacy20/cts/LegacyNotificationManager20Test.java]:[DND]:[2]:method_text:[InterruptedException ex) {                // pass            }        }        return n;    }}])', 1), ('([8:/android/media/cts/AudioManagerTest.java]:[DND]:[8]:method_text:[    @AppModeFull(reason = ""Instant apps cannot hold android.permission.MODIFY_AUDIO_SETTINGS"")   ])', 1), ('([1:/android/media/cts/AudioManagerTest.java]:[DND]:[1]:method_text:[ckageName(), getInstrumentation(), true);            testStreamMuting(stream);        }    }   ])', 1), ('([1:/android/media/cts/AudioManagerTest.java]:[DND]:[1]:method_text:[etStreamMute failed."",                    mAudioManager.isStreamMute(stream));        }    }   ])', 1), ('([4:/android/media/cts/AudioManagerTest.java]:[DND]:[4]:method_text:[            setInterruptionFilter(NotificationManager.INTERRUPTION_FILTER_ALL);        }    }   ])', 1), ('([7:/android/media/cts/AudioManagerTest.java]:[DND]:[7]:method_text:[ss(mContext.getPackageName(), getInstrumentation(),                    false);        }    }   ])', 1), ('([1:/com/android/cts/delegate/CertInstallDelegateTest.java]:[DND]:[1]:method_text:[ation().getContext();        mDpm = context.getSystemService(DevicePolicyManager.class);    }   ])', 1), ('([1:/com/android/cts/profileowner/AdminActionBookkeepingTest.java]:[DND]:[1]:method_text:[ * Test: It should be recored whether the Profile Owner or the user set the current IME.     */   ])', 1), ('([2:/android/telecom/cts/CarModeInCallServiceTest.java]:[MODE_TYPE_NORMAL]:[2]:method_text:[  * Verifies that a car mode InCallService can enter and exit car mode using a priority.     */   ])', 1), ('([1:/android/telecom/cts/CarModeInCallServiceTest.java]:[MODE_TYPE_NORMAL]:[1]:method_text:[mode InCallService when a call is started when the device is     * already in car mode.     */   ])', 1), ('([1:/android/telecom/cts/CarModeInCallServiceTest.java]:[MODE_TYPE_NORMAL]:[1]:method_text:[ies that the lower priority app is bound     * and receives information about the call.     */   ])', 1), ('([1:/android/telecom/cts/CarModeInCallServiceTest.java]:[MODE_TYPE_NORMAL]:[1]:method_text:[milar to {@link #testSwitchToCarMode}, except exits car mode before the call terminates.     */   ])', 1), ('([1:/android/telecom/cts/CarModeInCallServiceTest.java]:[MODE_TYPE_NORMAL]:[1]:method_text:[ters car mode after the call starts.  Also     * uses multiple car mode InCallServices.     */   ])', 1), ('([1:/android/telecom/cts/CarModeInCallServiceTest.java]:[MODE_TYPE_NORMAL]:[1]:method_text:[ -- bind error"");        }        return queue.poll(ASYNC_TIMEOUT, TimeUnit.MILLISECONDS);    }}])', 1), (""([1:/com/android/cts/deviceandprofileowner/SecurityLoggingTest.java]:[DND]:[1]:method_text:[ there's one user on the device or all     * secondary users / profiles are affiliated.     */   ])"", 1), ('([1:/com/android/cts/deviceandprofileowner/DelegatedCertInstallerTest.java]:[DND]:[1]:method_text:[  mDpm.setCertInstallerPackage(ADMIN_RECEIVER_COMPONENT, null);        super.tearDown();    }   ])', 1), ('([4:/android/app/cts/NotificationManagerTest.java]:[DND]:[4]:method_text:[anupSendBubbleActivity() {        mContext.unregisterReceiver(mBubbleBroadcastReceiver);    }   ])', 1), ('([5:/android/app/cts/NotificationManagerTest.java]:[DND]:[5]:method_text:[nalFilter);            mNotificationManager.setNotificationPolicy(origPolicy);        }    }   ])', 1), ('([3:/android/app/cts/NotificationManagerTest.java]:[DND]:[3]:method_text:[) != Notification.VISIBILITY_SECRET);        assertFalse(createdChannel.canBypassDnd());    }   ])', 1), ('([4:/android/app/cts/NotificationManagerTest.java]:[DND]:[4]:method_text:[te(id, condition);        assertExpectedDndState(ruleToCreate.getInterruptionFilter());    }   ])', 1), ('([8:/android/app/cts/NotificationManagerTest.java]:[DND]:[8]:method_text:[        // make sure DND is off        assertExpectedDndState(INTERRUPTION_FILTER_ALL);    }   ])', 1), ('([6:/android/app/cts/NotificationManagerTest.java]:[DND]:[6]:method_text:[        // make sure DND is off        assertExpectedDndState(INTERRUPTION_FILTER_ALL);    }   ])', 1), ('([7:/android/app/cts/NotificationManagerTest.java]:[DND]:[7]:method_text:[cZenRule(secondId);        assertExpectedDndState(ruleToCreate.getInterruptionFilter());    }   ])', 1), ('([1:/com/android/cts/deviceowner/AdminActionBookkeepingTest.java]:[DND]:[1]:method_text:[    /**     * Test: Retrieving security logs should update the corresponding timestamp.     */   ])', 1), ('([2:/android/ndef/cts/NdefTest.java]:[DND]:[2]:method_text:[on for input "" + bytesToString(b));            } catch (FormatException e) { }        }    }   ])', 1), ('([1:/android/provider/cts/simphonebook/SimPhonebookContract_SimRecordsNoSimTest.java]:[DND]:[1]:method_text:[entaryFiles.EF_SDN,                                1),                        values));    }   ])', 1), ('([1:/android/app/cts/UiModeManagerTest.java]:[MODE_TYPE_NORMAL]:[1]:method_text:[ar mode API when the caller does not hold the correct     * permission to use that API.     */   ])', 1), ('([2:/android/app/notification/legacy29/cts/NotificationManager29Test.java]:[DND]:[2]:method_text:[ent.getActivity(                mContext, 0, new Intent(mContext, this.getClass()), 0);    }   ])', 1), ('([4:/com/android/cts/verifier/audio/RingerModeActivity.java]:[DND]:[4]:method_text:[eRingerDndOn());        tests.add(new TestSetRingerModePolicyAccessDndOn());        // TODO: Add a])', 1), ('([2:/com/android/cts/verifier/audio/RingerModeActivity.java]:[DND]:[2]:method_text:[TestVibrateRinger());        tests.add(new TestSetRingerModePolicyAccess());        // TODO: Add a])', 1), ('([16:/com/android/cts/verifier/audio/RingerModeActivity.java]:[DND]:[16]:method_text:[dioManager.getStreamVolume(AudioManager.STREAM_MUSIC));            status = PASS;        }    }])', 1), ('([1:/com/android/cts/certinstaller/DirectDelegatedCertInstallerTest.java]:[DND]:[1]:method_text:[ption {        mDpm.uninstallCaCert(null, TEST_CA.getBytes());        super.tearDown();    }   ])', 1)]"	""	""	""	""	""
